{"caveat":"Top-lift rules are dominated by colour and pattern variants of one product (flagged variant_of_same_product); the featured list shows non-variant rules first. Association is co-occurrence in one invoice, not causation, and wholesale buyers order many lines at once.","edges":[{"a":"23174","b":"23175","count":243,"lift":90.6415828125885,"same_family":true,"support":0.006149407834801093},{"a":"23173","b":"23174","count":233,"lift":68.73527830864788,"same_family":true,"support":0.0058963457839862335},{"a":"23173","b":"23175","count":226,"lift":65.25175356558336,"same_family":true,"support":0.005719202348415831},{"a":"22816","b":"22818","count":243,"lift":54.51442001998365,"same_family":true,"support":0.006149407834801093},{"a":"21716","b":"21718","count":262,"lift":44.69672584098915,"same_family":false,"support":0.006630225731349327},{"a":"21715","b":"21718","count":256,"lift":44.48023778849663,"same_family":false,"support":0.006478388500860411},{"a":"84596B","b":"84596L","count":207,"lift":43.5912559686221,"same_family":false,"support":0.005238384451867598},{"a":"22579","b":"22581","count":230,"lift":43.250594841534216,"same_family":true,"support":0.005820427168741775},{"a":"23170","b":"23173","count":199,"lift":42.478846153846156,"same_family":true,"support":0.00503593481121571},{"a":"85049C","b":"85049D","count":212,"lift":41.59537641135639,"same_family":true,"support":0.005364915477275028},{"a":"84596B","b":"84596G","count":269,"lift":41.43365425842916,"same_family":true,"support":0.006807369166919729},{"a":"21242","b":"21245","count":209,"lift":41.35045662100457,"same_family":true,"support":0.00528899686203057},{"a":"84596B","b":"84596F","count":457,"lift":40.1251649772698,"same_family":true,"support":0.011564935722239093},{"a":"21242","b":"21244","count":287,"lift":38.79086757990868,"same_family":true,"support":0.007262880858386477},{"a":"22593","b":"22595","count":292,"lift":34.92968456741539,"same_family":false,"support":0.007389411883793906},{"a":"21242","b":"21243","count":290,"lift":34.676688726090944,"same_family":true,"support":0.007338799473630934},{"a":"22059","b":"37448","count":209,"lift":34.152292576419214,"same_family":true,"support":0.00528899686203057},{"a":"22594","b":"22595","count":283,"lift":34.09958774454798,"same_family":false,"support":0.007161656038060533},{"a":"22578","b":"22581","count":251,"lift":33.986143092105266,"same_family":true,"support":0.0063518574754529815},{"a":"21238","b":"21241","count":199,"lift":33.493841042678255,"same_family":true,"support":0.00503593481121571},{"a":"21508","b":"21509","count":282,"lift":32.79934539717673,"same_family":true,"support":0.007136349832979046},{"a":"21507","b":"21509","count":290,"lift":31.246291772096676,"same_family":true,"support":0.007338799473630934},{"a":"20674","b":"20676","count":342,"lift":30.21627785305126,"same_family":true,"support":0.008654722137868205},{"a":"85049C","b":"85049G","count":209,"lift":29.33223943571931,"same_family":true,"support":0.00528899686203057},{"a":"21507","b":"21508","count":232,"lift":29.016889068948927,"same_family":true,"support":0.005871039578904748},{"a":"21240","b":"21243","count":281,"lift":28.706812441346717,"same_family":true,"support":0.00711104362789756},{"a":"20675","b":"21243","count":252,"lift":28.56750406651003,"same_family":true,"support":0.006377163680534467},{"a":"21239","b":"21244","count":241,"lift":28.496404793608523,"same_family":true,"support":0.006098795424638121},{"a":"22577","b":"22581","count":227,"lift":28.372128036437246,"same_family":true,"support":0.005744508553497317},{"a":"21498","b":"21499","count":259,"lift":27.7421771657812,"same_family":true,"support":0.006554307116104869},{"a":"21238","b":"21240","count":473,"lift":26.916589262493034,"same_family":true,"support":0.011969835003542869},{"a":"20677","b":"21244","count":226,"lift":26.406315789473684,"same_family":true,"support":0.005719202348415831},{"a":"21238","b":"21239","count":447,"lift":26.046706274247846,"same_family":true,"support":0.011311873671424234},{"a":"23355","b":"23356","count":236,"lift":25.053665455952203,"same_family":true,"support":0.005972264399230692},{"a":"20675","b":"20676","count":424,"lift":25.028134046767587,"same_family":true,"support":0.010729830954550056},{"a":"85014A","b":"85014B","count":420,"lift":24.93048128342246,"same_family":true,"support":0.010628606134224112},{"a":"22169","b":"22170","count":251,"lift":24.60712274390622,"same_family":false,"support":0.0063518574754529815},{"a":"20675","b":"21239","count":315,"lift":23.917201307347778,"same_family":true,"support":0.007971454600668084},{"a":"21428","b":"21430","count":228,"lift":23.80293255131965,"same_family":false,"support":0.005769814758578804},{"a":"21912","b":"22550","count":209,"lift":23.46929241261722,"same_family":false,"support":0.00528899686203057},{"a":"21238","b":"21244","count":237,"lift":23.306312292358804,"same_family":true,"support":0.005997570604312177},{"a":"21137","b":"22041","count":200,"lift":22.460567823343847,"same_family":true,"support":0.005061241016297196},{"a":"21498","b":"21500","count":223,"lift":22.33255276443039,"same_family":true,"support":0.005643283733171373},{"a":"20677","b":"21240","count":327,"lift":22.109595510232015,"same_family":true,"support":0.008275129061645915},{"a":"20675","b":"21242","count":251,"lift":21.784524962607154,"same_family":true,"support":0.0063518574754529815},{"a":"21238","b":"21243","count":249,"lift":21.66289967834191,"same_family":true,"support":0.006301245065290009},{"a":"21240","b":"21242","count":276,"lift":21.586903468300765,"same_family":true,"support":0.006984512602490131},{"a":"21870","b":"21874","count":212,"lift":21.551778961179284,"same_family":true,"support":0.005364915477275028},{"a":"22909","b":"22950","count":208,"lift":21.50125565042692,"same_family":true,"support":0.005263690656949084},{"a":"85049A","b":"85049E","count":341,"lift":21.063241514494997,"same_family":false,"support":0.008629415932786719},{"a":"20676","b":"20677","count":391,"lift":21.04548872180451,"same_family":true,"support":0.009894726186861018},{"a":"21508","b":"22027","count":242,"lift":20.91868444366667,"same_family":true,"support":0.006124101629719607},{"a":"21239","b":"21242","count":258,"lift":20.6627145541105,"same_family":true,"support":0.006529000911023383},{"a":"20675","b":"21238","count":318,"lift":20.080712200313528,"same_family":true,"support":0.008047373215912541},{"a":"22698","b":"23171","count":198,"lift":19.879839318245917,"same_family":true,"support":0.005010628606134224},{"a":"21216","b":"21218","count":352,"lift":19.335207132669996,"same_family":true,"support":0.008907784188683066},{"a":"20973","b":"20974","count":261,"lift":19.068466709560045,"same_family":true,"support":0.006604919526267841},{"a":"21507","b":"22027","count":236,"lift":18.897981681121827,"same_family":true,"support":0.005972264399230692},{"a":"23204","b":"23206","count":286,"lift":18.711590296495956,"same_family":true,"support":0.00723757465330499},{"a":"22697","b":"23171","count":243,"lift":18.62758175183756,"same_family":true,"support":0.006149407834801093},{"a":"22734","b":"22739","count":214,"lift":18.611890235850304,"same_family":true,"support":0.005415527887438},{"a":"20677","b":"21242","count":234,"lift":18.51867339581831,"same_family":true,"support":0.005921651989067719},{"a":"21494","b":"21935","count":208,"lift":17.813077428205478,"same_family":false,"support":0.005263690656949084},{"a":"22367","b":"22899","count":218,"lift":17.70066327495089,"same_family":true,"support":0.005516752707763944},{"a":"21871","b":"21877","count":262,"lift":17.603128480221713,"same_family":true,"support":0.006630225731349327},{"a":"20973","b":"20975","count":263,"lift":17.510409154934322,"same_family":true,"support":0.006655531936430813},{"a":"21890","b":"21892","count":198,"lift":17.486284378450137,"same_family":false,"support":0.005010628606134224},{"a":"22698","b":"23170","count":203,"lift":17.450532429816068,"same_family":true,"support":0.005137159631541654},{"a":"21508","b":"22029","count":262,"lift":17.381597304416587,"same_family":true,"support":0.006630225731349327},{"a":"21892","b":"22620","count":301,"lift":17.289808093171185,"same_family":false,"support":0.00761716772952728},{"a":"20677","b":"21238","count":299,"lift":17.216418954362652,"same_family":true,"support":0.007566555319364308},{"a":"22699","b":"23170","count":275,"lift":17.14887640449438,"same_family":true,"support":0.006959206397408645},{"a":"22295","b":"22296","count":254,"lift":17.06699223598788,"same_family":true,"support":0.006427776090697439},{"a":"21507","b":"22029","count":276,"lift":16.962188794744502,"same_family":true,"support":0.006984512602490131},{"a":"22909","b":"22952","count":529,"lift":16.825686744195032,"same_family":true,"support":0.013386982488106084},{"a":"22029","b":"22712","count":237,"lift":16.7444270419876,"same_family":true,"support":0.005997570604312177},{"a":"22699","b":"23171","count":228,"lift":16.606299212598426,"same_family":true,"support":0.005769814758578804},{"a":"23199","b":"23204","count":237,"lift":16.425322796199055,"same_family":true,"support":0.005997570604312177},{"a":"22738","b":"22909","count":222,"lift":16.220595087532452,"same_family":false,"support":0.0056179775280898875},{"a":"21531","b":"21533","count":299,"lift":15.960043441613175,"same_family":true,"support":0.007566555319364308},{"a":"23202","b":"23208","count":235,"lift":15.815229609041303,"same_family":true,"support":0.005946958194149205},{"a":"22699","b":"23173","count":237,"lift":15.809495192307692,"same_family":true,"support":0.005997570604312177},{"a":"48111","b":"48188","count":201,"lift":15.804512893982809,"same_family":true,"support":0.005086547221378682},{"a":"21935","b":"21993","count":211,"lift":15.689893247675554,"same_family":false,"support":0.0053396092721935415},{"a":"22738","b":"22952","count":226,"lift":15.675667705788188,"same_family":false,"support":0.005719202348415831},{"a":"21533","b":"21539","count":268,"lif